company_name,job_categories,job_experience,job_level,job_link,job_location,job_requirement,job_role_resp,job_salaries_max,job_salaries_min,job_salaries_type,job_skills,job_title,job_typeRESMED ASIA PTE. LTD.,"Engineering, Sciences / Laboratory / R&D",,"Professional, Senior Executive",https://www.mycareersfuture.sg/job/senior-systems-engineer-%E2%80%93-data-architecture-resmed-asia-44a62f0e76666e5052f8af4ee1deb3c0,8 LOYANG CRESCENT 509016,"Let’s talk Qualifications and Experience:,Bachelor of Engineering in Electrical, Mechanical, Computer Systems or Mechatronics OR Bachelor of Science (in Biophysics for example),A postgraduate qualification in Biomedical Engineering would be an advantage.,Experience in cloud computing, data interfaces and medical device product development, preferably in complete development cycle.,Experience in cybersecurity management.,Okay, so what’s next?,Joining ResMed is more than saying “yes” to making the world a healthier place. It’s discovering a career that’s challenging, supportive and inspiring. Where a culture driven by excellence helps you not only meet your goals, but also create new ones. We focus on creating a diverse and inclusive culture, encouraging individual expression in the workplace and thrive on the innovative ideas this generates. Our hope is that each day you’ll uncover a new reason to love what you do. If this sounds like the workplace for you, apply now!","Senior Systems Engineer - Data Architecture,At ResMed (NYSE: RMD, ASX: RMD) we pioneer innovative solutions that treat and keep people out of the hospital, empowering them to live healthier, higher-quality lives. Our cloud-connected medical devices transform care for people with sleep apnea, COPD and other chronic diseases. Our comprehensive out-of-hospital software platforms support the professionals and caregivers who help people stay healthy in the home or care setting of their choice. By enabling better care, we improve quality of life, reduce the impact of chronic disease and lower costs for consumers and healthcare systems in more than 120 countries. To learn more, visit ResMed.com and follow @ResMed.,The Sleep team is helping to fuel ResMed’s growth by focusing on solutions (products + software + services) to improve the quality of life for patients with sleep-disordered breathing and help providers improve efficiencies and reduce their costs. We are pioneers in providing a better experience for patients on therapy, and helping them achieve and maintain adherence with innovative masks and sleep devices with cloud connectivity. With nearly a billion people estimated to be suffering from obstructive sleep apnea, this is an opportunity to make a difference and change people’s lives whether in Marketing, Sales, or product development.,Let's talk about Responsibilities:,As a Senior Systems Engineer for the Data Architecture team, you will be working closely with a range of stakeholders to ensure ResMed’s Respiratory Care devices are built with a sound data architecture strategy that will provide value add to the patient via the device directly and via connected digital platforms consuming data collected by the device.,This will be achieved more specifically by:,Defining a product’s data architecture specification to provide desired data related functionality, including functionality required to enable remote data capabilities. Desired data related functionality, including remote data capabilities are defined in collaboration with the Marketing team.,Collaborating with Marketing and Clinical teams to define the desired data related functionality relating to value offerings facilitated through data collected by, and through, the device.,Working with the Regulatory team to ensure conformance to the appropriate Regulatory Standards per applicable region.,Defining, delivering and maintaining data architecture specifications, working in close collaboration with the Systems Engineer to ensure astute integration of therapy related functionality and data related functionality.,Working with other engineering teams both within Respiratory Care and external to Respiratory Care to coordinate on the delivery of all products and systems in the integrated care offering as well as working with the V&V team to ensure adequate end to end system test coverage.,Working with the Systems Engineer to ensure data related risks are captured and appropriately analysed within the System Risk Analysis.,Coordinating the appropriate management of Cybersecurity risks, throughout the project lifecycle, including completion of the Cybersecurity risk analysis.,Identifying and evaluating technical design alternatives to achieve desired functionality with appropriate consideration from all identified stakeholders.,Resolving data related technical issues with the engineering disciplines and reviewing issues with the XFT where required. Representing engineering disciplines at the XFT for data architecture matters.,Ensuring full traceability of data architecture related requirements, working closely with the Systems Engineer.,Ensuring product achieves performance, functionality and reliability for data related features as specified in the MRD (and CRD where appropriate), working closely with the Systems Engineer.,Ensuring that ResMed Systems Engineering processes are adhered to and recommend updates to processes where appropriate.,Supporting Manufacturing for initial and ongoing production needs.,Supporting Sustaining engineering for released products.,Collating technical material to support regulatory submissions.,Observing the principles of Occupational Health & Safety Legislation.,Producing plans for delivery of Data Architecture deliverables, as required.,Assisting with the development of user guides and other documentation delivered with the product.,In a Senior role you will also be expected to:,Mentor and identify the need to mentor other staff as required.,Solve complex engineering problems more autonomously.,Communicate complex engineering problems at various technical levels, tailoring the communications appropriately.,Provide technical leadership on Data Architecture matters both within your team and externally, including work with other departments to drive consistency on data architecture design across the ResMed business.,Leading innovation within your team through identification and implementation of improvements in engineering and business practices.","$10,000","$8,000",Monthly,"Active Directory,Cloud Computing,Data Center,Disaster Recovery,Integration,Linux,Networking,Program Management,Project Management,Security,Servers,Software Development,SQL,System Administration,Systems Engineering,Testing,Unix,Virtualization,VMware,Windows Server",Senior Systems Engineer – Data Architecture,"Permanent, Full Time"
CAPGEMINI SINGAPORE PTE. LTD.,Information Technology,,Professional,https://www.mycareersfuture.sg/job/data-engineer-capgemini-singapore-6881270e60e57757dd030a42764e21ad,6 BATTERY ROAD 049909,"Activities:,• Industrialize data integration, data cleansing, data analytics programs or data management processes.,• Contribute to the design, development, testing, deployment, performance in production and maintenance of the data-centric software including APIs, cloud-based architectures, libraries, toolbox.,• Liaise with the Data Scientists, Architects, software developers, and business experts to understand how data needs to be converted, loaded, processed and presented.,• Help the Data Architect to create an overview of the Data Lineage (from data flows, data transformations inside applications).,• Provide clear documentation of the business rules embedded in the systems and potentially manage or help solving Data Quality issues.,• Adapt to local context and tools provided by AXA’s entity as well as local entity development standards and IT landscape.,Skills:,• Technical: Strong development skills - languages will depends on the entity but mainly python and Scala, Big Data experience (Spark, Hadoop Suite) Experience in Git, continuous integration and delivery.,• Awareness on Data Management practices, including Data Lifecycle Management across Core IT & Big Data ecosystems as well as Data Privacy & Security constraints.,• Knowledge in Data Modelling (including third normal form, star schema, data vault modelling methods).,• Focus on end user and customer centricity, Strong oral and written communication skills, Passion for learning new tools, languages and frameworks, Fast adaptation to changing requirements, Strong problem-solving skills, able to work with minimal direct guidance, self-motivated and proactive, in a collaborative model, side by side with the business, Practical, hands on approach to get results.,• Experienced in Cloud services & architecture.,• Discipline in writing technical & non-technical documentation.","We are looking for Jr and Sr Data Engineers for Capgemini Singapore,Activities:,• Industrialize data integration, data cleansing, data analytics programs or data management processes.,• Contribute to the design, development, testing, deployment, performance in production and maintenance of the data-centric software including APIs, cloud-based architectures, libraries, toolbox.,• Liaise with the Data Scientists, Architects, software developers, and business experts to understand how data needs to be converted, loaded, processed and presented.,• Help the Data Architect to create an overview of the Data Lineage (from data flows, data transformations inside applications).,• Provide clear documentation of the business rules embedded in the systems and potentially manage or help solving Data Quality issues.,• Adapt to local context and tools provided by AXA’s entity as well as local entity development standards and IT landscape.,Skills:,• Technical: Strong development skills - languages will depends on the entity but mainly python and Scala, Big Data experience (Spark, Hadoop Suite) Experience in Git, continuous integration and delivery.,• Awareness on Data Management practices, including Data Lifecycle Management across Core IT & Big Data ecosystems as well as Data Privacy & Security constraints.,• Knowledge in Data Modelling (including third normal form, star schema, data vault modelling methods).,• Focus on end user and customer centricity, Strong oral and written communication skills, Passion for learning new tools, languages and frameworks, Fast adaptation to changing requirements, Strong problem-solving skills, able to work with minimal direct guidance, self-motivated and proactive, in a collaborative model, side by side with the business, Practical, hands on approach to get results.,• Experienced in Cloud services & architecture.,• Discipline in writing technical & non-technical documentation.","$7,500","$5,000",Monthly,"Access,Business Analysis,Business Intelligence,Data Analysis,Database Design,Databases,HTML,Integration,Management,Microsoft Excel,Microsoft SQL Server,Process Improvement,Program Management,Project Management,SDLC,SharePoint,SQL,T-SQL,Visio,Windows",Data Engineer,"Permanent, Contract"
INFOCEPTS PTE. LTD.,Information Technology,,Middle Management,https://www.mycareersfuture.sg/job/data-scientist-infocepts-f5ec58e8489a1fa90be0fd24f05dfd97,"THE SIGNATURE, 51 CHANGI BUSINESS PARK CENTRAL 2 486066","Skills and Qualifications:,Relevant years of experience i.e. minimum 3+ years of experience in data or statistical analysis, with mathematical and causal modelling skills,Experience of analyzing data from relational data sources, Flat files, CSV files,Experience of writing Advanced SQL (Oracle, SQL Server, MSACCESS), Hive Query Language (Hadoop) queries for Data Reconciliation, Data Completeness, Data cleanness, Data Transformation, Segmentation, Normalization and Data Quality tests.,Good understanding of ETL Concepts and Data Modelling in RDBMS vs non-relational database,Knowledge of working on NoSQL technologies like Hadoop, MapR, Cassandra etc.,Working with data visualization frameworks for web applications such as D3.js, HighCharts etc. would be an added advantage,Candidates with exposure in retail domain will be preferred,Exposure in working in Agile environments,Must be an individual contributor,Engineering from premier institutes (preferably in statistics, applied math, or related discipline),Ability to come up with solutions to loosely defined business problems by leveraging pattern detection over potentially large datasets.","Introduction:,We’re seeking an experienced data scientist to deliver insight to us on a daily basis. The ideal team member will have the mathematical and statistical expertise you’d expect, but a natural curiosity and creative mind that’s not so easy to find. As you mine, interpret, and clean our data, we will rely on you to ask questions, connect the dots, and uncover opportunities that lie hidden within—all with the ultimate goal of realizing the data’s full potential. You will join a team of data specialists, but will “slice and dice” data using your own methods, creating new visions for the future.,Job Description,Responsibilities:,Provide business with meaningful data by using data mining techniques, including pattern detection, graph analysis or statistical analysis.,Work with the business stakeholders to identify data requirements, model and frame business scenarios that are meaningful and which impact on critical business processes and/or decisions.,Identifying important datasets out of tons of data provided to you based on retail domain knowledge and interaction with business stakeholders,Manage mapping of data fields from Relational databases to NoSQL data bases,Design data models in non-relational databases and migrate data from relational to non-relational databases,Enable data validation frameworks to validate data migrated from relational to non-relational databases,Ability to independently process, sanitize, and verifying the integrity of data used for analysis,Ability to enhance/optimize data migration procedures to include data that is relevant for building analytic systems,Support reporting analysts in enabling the required data in flattened structures,Work with IT teams to support data collection, integration and retention requirements based on the input collected with the business.,Ensure that the information used follows the compliance, access management and control policies of the organization.,Suggest ongoing improvements to methods and algorithms that lead to findings, including new information.,Understand the use and ability to employ the appropriate algorithm to discover patterns.","$10,000","$7,000",Monthly,"Business Analysis,Business Intelligence,Data Analysis,Data Architecture,Data Integration,Data Modeling,Data Warehouse Architecture,Data Warehousing,Database Design,Databases,Enterprise Architecture,ETL,Integration,Master Data Management,Microsoft SQL Server,Oracle,PL/SQL,Requirements Analysis,SDLC,SQL",Data Scientist,Permanent
ALEXANDER MANN BPO SOLUTIONS (SINGAPORE) PTE. LTD.,Banking and Finance,,Professional,https://www.mycareersfuture.sg/job/officer-change-support-reference-data-services-operations-merrill-lynch-global-services-7c8558da5add8d3aa3d11b353dde0283,"SGX CENTRE I, 2 SHENTON WAY 068804","Proven experience in a Change function. Previous experience in a Reference Data function desirable,Client focused to provide highest quality of service to internal / external clients in the most efficient way.,Excellent written and verbal communication skills with ability to interact with senior stakeholders and delivery partners alike,Strong analytical skills.,Thinks strategically and is delivery-focused","About Bank of America Merrill Lynch:,Our purpose as a firm is to make financial lives better, through the power of every connection. Across the world, we partner with leading corporate and institutional investors through our offices in more than 40 countries. In the U.S alone, we serve almost all Fortune 500 companies and approximately 59 million consumers and small-business customers. We provide a full suite of financial products and services, from banking and investments to asset and risk management. We cover a broad range of asset classes, making us a global leader in corporate and investment banking, sales and trading.,Connecting Asia Pacific to the World,Our Asia Pacific team is spread across 23 offices in 12 markets. We are focused on connecting Asia to the world and the world to Asia, using our global expertise to ensure success is shared between us, our clients and our communities. Our regional footprint covers 12 currencies, more than a dozen languages and five time zones, placing us firmly among the region’s leading financial services companies.,Bank of America Merrill Lynch is committed to attracting, recruiting and retaining top diverse talent from across the globe. Our diversity and inclusion mission is to actively promote an inclusive work environment where all employees have the opportunity to achieve personal success and contribute to the growth of our business. Each of our global Employee Networks bring together employees, create dialogue and awareness in support of our Diversity and Inclusion mission.,Bank of America Merrill Lynch is an equal opportunities employer.,Position Description,The Reference Data Services Organization are part of the broader Global Markets Operations & Middle Office (GMOMO) for Bank of America Merrill Lynch (BAML).,Functional responsibilities of Reference data team include the following:,Account setup, documentation, and maintenance, described in more detail as following:,Manage all account level setup, approvals, payment instructions and data management.,Make sure that all the necessary contact, Standard Settlement Instructions (SSI), commission agreements are set up correctly. Perform a secondary check to ensure all required account documentation is obtained including tax forms. Coordinate the completion of required documentation with clients, based on specific type of financing vehicle or trading requirement. Manage required documentation for new accounts, document's replacement and signature validation. Function primarily perform by the core Onboarding teams with assistance from the allocation support teams.,Keep updated documents that supports the opening account. Manage all new account set-up's and ensure the data is amended and accounts closed/dormant as per the policy/control in the relevant systems. Maintain all account level reviews, approvals, payment instructions and data management.,Product Data setup and maintenance, described in more detail as following:,Timely and accurate setup of product reference data in multiple databases. Proactively analyze and develop methods to improve and prevent data inconsistencies. Consistently provide high quality data through continual reconciliation, research, comparison and cleansing of data. Provide a point of contact for clients for their product data initiatives. Develop business requirements and perform testing for implementation of PME data feeds to our clients.,Timely and accurate maintenance of product reference data in multiple databases. Proactively analyze and develop methods to improve and prevent data inconsistencies. Consistently provide high quality data through continual reconciliation, research, comparison and cleansing of data. Provide a point of contact for clients for their product data initiatives. Develop business requirements and perform testing for implementation of PME data feeds to our clients.,RESPONSIBILITIES,This role is to provide BA/Change support for the Reference Data Services function for the Asia Pacific region.,Carry out analysis to understand Business Requirements and write effective Business Requirements Documentation,Partner with Regional Reference Data Service lead, offshore support functions and IT Development teams to help define strategic change solutions,Oversight/Delivery of UAT,Attend Global Steering Meetings.","$8,000","$4,000",Monthly,"Analysis,Business Strategy,Change Management,Customer Service,Government,Leadership,Management,Microsoft Office,Military,Policy,Program Management,Project Management,Project Planning,Public Speaking,Research,Strategic Planning,Strategy,Team Building,Team Leadership,Training","Officer, Change Support, Reference Data Services Operations",Permanent
GOVERNMENT TECHNOLOGY AGENCY,"Information Technology, Public / Civil Service",,Middle Management,https://www.mycareersfuture.sg/job/business-analyst-government-technology-agency-aa6ae31e2c948165269b7ad64ebf9c17,"MAPLETREE BUSINESS CITY, 10 PASIR PANJANG ROAD 117438",,"We are looking for Business Analysts (Data Analytics) who’s interested in using data to help the government design solutions that address its policy and business problems, and stay close to the needs of the general public. The applicant will be responsible for demonstrating how better use of data can help recommend new policies, streamline operations or bring more customised solutions for citizens. He/ She should have some training and working experiences on data analytics, and should be comfortable with hands-on data manipulation, data modelling and data visualisation.,What to Expect:,Provide data analytics consulting services to the government agencies, including data analytics planning and strategy – perform data analytics visioning and road-mapping, business case development, implementation planning, organisational planning, budget and risk management planning,Work closely with stakeholders to understand their needs/ pain points, scope the problem and develop business case on how to turn data into critical information and knowledge that can be used for policy making, streamlining operations or developing solutions for citizens.,Advise stakeholders on the key ICT trends and best practices in data analytics, assess applicability for adoption and recommend solution that best fits stakeholders’ needs,Perform data cleaning, pre-processing and feature engineering that facilitate meaningful analysis,Work closely with data scientists to mine insights from structured and unstructured data and to resolve complex statistical modelling problems to answer pertinent business questions.,Design dashboards and interactive visualisation as tools for data exploration as well as for storytelling. Present analytics insights to business users and stakeholders,Work with stakeholders to ensure smooth deployment and adoption of new solution,How to Succeed:,Degree/Master in any discipline that would equip the candidate with the necessary skills to come up with strategic solutions for IT projects,Minimum 3 years of relevant working experience,Ability to take a broad, strategic perspective as well as drill deep to understand business needs and challenges,Understand key concepts, techniques and considerations in Machine learning and Data analytics,Training and relevant experience in one or more of the following areas:,Statistical modelling tools such as: R, Python, RapidMiner, Knime, SAS, Matlab or SPSS,Data manipulation using scripting languages like Python or using ETL tools,Visual analytics technologies like Tableau, Qlikview or D3.js,End-to-end analytics architecture, preferably with some working knowledge of big data stack,Excellent communications skills, both oral and written, with ability to pitch ideas and influence stakeholders,Strong analytical, conceptualisation and problem solving skills,Team player with strong organisation and people handling skills,Passion for the use of analytics and data to improve public service","$9,000","$5,000",Monthly,"Analysis,Business Analysis,Business Intelligence,Business Process,Business Process Improvement,Business Strategy,Change Management,Data Analysis,Leadership,Management,Management Consulting,Microsoft Office,Process Improvement,Program Management,Project Management,Requirements Analysis,Requirements Gathering,SDLC,SQL,Strategy",Business Analyst (Data Analytics),Full Time
