company_name,job_categories,job_experience,job_level,job_link,job_location,job_requirement,job_role_resp,job_salaries_max,job_salaries_min,job_salaries_type,job_skills,job_title,job_typeSINGAPORE AIRLINES LIMITED,Information Technology,,"Professional, Executive",https://www.mycareersfuture.sg/job/data-sciences-analytics-engineer-singapore-airlines-1617e1bd1b81746a8a0d110d423d47cb,"AIRLINE HOUSE, 25 AIRLINE ROAD 819829","BS degree in Computer Science or a related technical field. MS or PhD degree is a plus.,More than 2 years of advanced Python or Java development is necessary. Scala or Kotlin experience is a plus.,More than 2 years of SQL (such as PostgreSQL, Oracle, AWS Redshift, or Hive) experience is required. NoSQL experience is a plus.,More than 2 years working with Linux OS. Knowledge of networks and cybersecurity is a plus.,Experience with modern MapReduce/workflow distributed systems, especially Apache Spark. Experience with Apache Kafka is a plus.,Experience working with infrastructure-as-code systems like AWS CloudFormation. DevOps experience is a plus.,Experience in custom ETL pipeline design, implementation and maintenance.,Experience working with visualization tools like Tableau or Apache Superset.,Ability in analyzing data to identify deliverables, gaps and inconsistencies.,Ability in managing and communicating data mart plans to internal customers.","We have multiple junior and senior data engineering positions available. The data engineer is responsible for designing and developing robust, scalable solutions for collecting and analysing large data sets in the cloud and on-premises data centres. Also in creating and maintaining data pipelines, data marts and business intelligence dashboards to be used across Singapore Airlines. Responsibilities:,Understand business processes, applications and how data is stored and gathered.,Develop and manage streaming data pipelines at enterprise scale.,Build expertise on the data. Own data quality for various data flows.,Design, build and manage data marts to satisfy our growing data needs.,Support data marts to provide intuitive analytics for internal customers.,Design and build new framework and automation tools to enable teams to consume and understand data faster.,Use your expert coding skills across a number of languages like SQL, Python and Java to support data scientists.,Interface with internal customers to understand data needs.,Collaborate with multiple teams and own the solution end-to-end.,Maintain infrastructure for our data pipelines.,Any other ad-hoc duties.,This is a sole contributor role.","$8,000","$4,000",Monthly,".NET,Agile Methodologies,CSS,Data Warehousing,Database Design,Databases,ETL,HTML,Java,JavaScript,Linux,Microsoft SQL Server,MySQL,Oracle,PHP,Software Development,SQL,SSIS,T-SQL,XML",Data Sciences & Analytics Engineer (Data Engineering Track),Permanent
CAREER TREND PTE. LTD.,Information Technology,,Executive,https://www.mycareersfuture.sg/job/hr-data-analyst-mnc-central-5-days-week-1-year-contract-career-trend-0c3a69063a22450c81d26565c20cce5f,"THE ADELPHI, 1 COLEMAN STREET 179803","5-7 years of experience in a technology based MNC.,• Experience in,data analysis, including understand data structure, handling multiple data source, inspection, cleansing, understanding data structure, multiple system platform integration and transforming data.,• Proficiency in SQL, Publisher, Oracle Fusion OTBI, SAP,IBM Cognos TM1,,Microsoft Office (Macro, Access, Word, Excel, Powerpoint).,•,Degree in Computer Science or related discipline,• Independent, result-oriented, meticulous with analytical ability.,• Well organised and disciplined in maintaining documentation,• Proactively identify data issues, ability to provide resolution to correct data to ensure data integrity.,• Self-motivated, attentive to details with good interpersonal skills.,If you are keen in this position, kindly send your resume to ec@careertrend.com.sg,(Eileen Chin, EA Personnel Registration No.: R1108737)","Responsible in supporting to develop and implementation of HR data governance framework across group of companies to ensure data quality and standard of HRIS., Provide system and process governance with the objective of maintaining a regional system with standardization of HR Processes, Proactively seek opportunity to standardize data definition and data field to continue improve data quality., Gather data to examine, identifies data gaps for data patching., Identifies data patterns & trends, and provides insights to exchange business decision making capability in business planning, process improvement, and solutions assessment., Audit data to ensure the information is captured meaningfully., Serves as Human Resources analytical expert in support of building report, processes, data mining to business decision making.,,Provide guidance to HR community on data definition, rules, policies accordance to governance framework or SOP on preparation of statistics, reports, data analysis and interpretation., Provide mentorship to HR community on data related programmes, such as report generation, data mining to draw insights and trends to make sense of data., Drive data governance awareness program across group of companies to ensure data quality and integrity., Prepare, maintain and present data quality reports as required.","$5,500","$4,000",Monthly,"Active Directory,Cisco Technologies,Data Center,Disaster Recovery,Firewalls,Integration,Network Administration,Network Engineering,Network Security,Networking,Routers,Security,Servers,Switches,TCP/IP,Telecommunications,Troubleshooting,VPN,WAN,Windows Server",HR Data Analyst / MNC / Central / 5 days week / 1 year contract,Contract
FWD SINGAPORE PTE. LTD.,Information Technology,,Middle Management,https://www.mycareersfuture.sg/job/senior-data-architecture-manager-fwd-singapore-6ad738595749978430e94d609dc34167,"SUNTEC TOWER FOUR, 6 TEMASEK BOULEVARD 038986","QUALIFICATIONS / EXPERIENCE,Minimum 10 years of professional experience in big data, data warehousing, operational data stores, and large scale architecture and implementations.,Expertise in Big Data and Data Lake technologies.,Experience with Hadoop, Spark, Hortonwork, MapR, Cloudera, RDBMS, Hbase, and Stream Processing.,Experience with ETL, like Talend, Informatica.,Experience of building data lake solutions on AWS stack,Experience on Data Modelling,Experience in solution crafting and developing proposals to illustrate business value provided by technical solutions.,Strong understanding of data analytics and data visualization.,Drive change management of new data capabilities and architectural direction.","PURPOSE,You will be both team leader and an individual contributor in entrepreneurial work environment responsible for defining and implementing data architecture, data warehouse and data lake for FWD Singapore.,KEY ACCOUNTABILITIES,Build data lake, data warehouse and data APIs in FWD Singapore by using suitable technology.,Develop and implement the Data Strategy,Plan and monitor career development for each Data staff,Document data standards, requirement specifications, and business processes,KEY PERFORMANCE INDICATORS,Develop and maintain a data architecture roadmap indicating current, transition, and future state architectures to align with business and analytics strategy.,Lead a team of Data Engineers.,Develop Common Data Model and Schema.,Deliver data architectural initiatives that create value for Single View of Customer and MIS dashboard.,Stay current on emerging technologies; analyze, prototype and develop a point of view for core, enabling, and emerging technologies.,Develop framework, metrics, and reporting to ensure progress can be measured, evaluated and continually improved; communicate progress effectively with the executive team.,Develop data APIs to support different use cases/ systems to make data lake more operational.,Create data as service platform.,Manage Data Governance including dissemination of information and security aligning with the FWD SG Growth strategies revolving around Customer centric services strategy.,Should be able to work with the actuarial team to build models for data insights which will aid the business.","$10,000","$8,000",Monthly,"Business Analysis,Business Intelligence,Data Analysis,Data Architecture,Data Integration,Data Modeling,Data Warehouse Architecture,Data Warehousing,Database Design,Databases,Enterprise Architecture,ETL,Integration,Master Data Management,Microsoft SQL Server,Oracle,PL/SQL,Requirements Analysis,SDLC,SQL",Senior Data Architecture Manager,Permanent
HUBBLE PTE. LTD.,Information Technology,,Professional,https://www.mycareersfuture.sg/job/junior-data-scientist-hubble-ea469ffbfdbf74a06767387a8c83c2d3,"ONE PEMIMPIN, 1 PEMIMPIN DRIVE 576151","What skill sets do you need:,Proficient in Python.,Proficient in one query language SQL, such as MySQL.,Experience with cloud platform GCE or AWS.,Experience with Big Query/ Redshift.,Experience with essential tools like Git, Docker.,Machine Learning knowledge is highly desirable.","Who are we:,Hubble is a technology startup focused on revolutionising the Construction Industry. The Construction industry undertakes the world’s largest, most expensive, and complex projects ever dreamt of by mankind. Yet, the Construction industry is notoriously slow to adopt new technologies and as a result, there exists a large amount of inefficiencies and problems that Hubble can create positive value and make a great impact on. This impacts the homes people live in, offices people work in, and cities generations live in.,There is no other industry where technology can have a greater impact. Bar none.,Hubble’s vision is to build the pillars of trust for the Construction industry and we are on a mission to develop the autonomous self-building construction sites of tomorrow - powered by big data, machine learning, and artificial intelligence.. Our first step to our mission is to track the Man, Machine, Material, and Money (4M) data - for the Construction industry. The 4M data can be used to optimise operations at the worksites as well as to build an automated trading platform for the 4M. We have grown rapidly to become the market leader in each of the 4M verticals:,1. Man: We have more than 10,000 construction workers (~5% market share) on Hubble's platform and have tracked more than 35 million man-hours in total.,2. Machine: We track more than 1.5 million machinery transactions/year and have >US$100 million worth of machinery on Hubble's platform today.,3. Material: We developed Hubble Maps (Patent Pending) for precise indoor material and man tracking. We were awarded BCA's Innovation Grant 2018 and presented our technology to DPM Teo Chee Hean.,4. Money: We are deployed at iconic projects such as Project Jewel, Paya Lebar Quarters, Gardens by the Bay, and City Gate and have tracked more than $1 billion in project value.,Interesting fact: We have grown rapidly without any venture funding to become the market leader in this space in less than 1 year. Our partners include the largest and most prestigious Construction companies such as Woh Hup, Lum Chang, Hexacon, Erect Group, Koh Kock Leong Enterprise, Chuan Lim Construction, and OAS Painting and Construction.,We have also built the best engineering, product, and business team comprising the best and brightest of Singapore. We are a collegial set up and are extremely collaborative. We are hiring aggressively and are looking for motivated, smart, driven, and resourceful people to join our team.,Who are we looking for:,Hubble has entered into a 12 - 18 months partnership with 2 leading Data Companies who are experts in big data, machine learning, and artificial intelligence - BoostML (see attached BoostML_Intro.pdf) and A*Star (see here) to help build up Hubble’s data infrastructure and strategy. BoostML will station 3 senior data scientists and engineers at Hubble full time over 18 months. We are looking for a talented Junior Data Scientist/Engineer who is passionate about this space and looking to learn the tools of the trade from the best in the business. You will be learning from BoostML and A*Star to build up Hubble’s data capabilities and take full ownership and leadership of this vertical at the end of 18 months after BoostML and A*Star completes the build up phase. This is an exciting and challenging role and our bet is on you. We want to groom and train you to become the future leaders in Hubble (see What Hubble will give you section).,Your current mood:,You want to be a data scientist but lack the ‘right’ paper qualifications for the job. You feel that you have talents in abundance but they are not recognised because of ‘paper qualifications’. You want to make an impact at work and make a dent in the universe. You want to be in a dynamic, fun, and energetic environment. You also want to be mentored by the best data scientists and engineers in Asia and aspire to take on leadership role in a fast growing startup. You want to step up to the plate now. You want to bat for home run and help build up the data capability of a fast growing company - Hubble.,What Hubble will give you:,Hubble is built by a team of talented, driven, and ambitious individuals. We do not subscribe to conventions. We do not let history and traditions dictate and limit our dreams to shape the world. We adopt the same mindset with our hiring. We are looking for the best and we want to bet on you. In this position, we will give you all the exposure and resources you need to eventually grow into the role of Head of Data. If you mindset is right, we promise you the ride of your life.,Who will you be working with:,If you connect with any of the description below, please apply immediately:,Purpose driven,Hungry, ambitions, and self-motivated,Meritocratic, results/performance > age/bureaucracy,Resourceful, independent, chart our own destiny,Determined, perseverance, and hard working,Creative, innovative, out of the box,Yes, the above is everyone of us at Hubble.,What will you be doing:,Trained under BoostML and A*Star and to be main coordinator,To be the overall in-charge with data related matters at Hubble,Processing data pipelines.,Build and maintain data mart and data warehouse.,Development of Machine Learning apps,Development of resource optimisation algorithms such as automated deployment algorithms for 4M","$7,100","$3,600",Monthly,"Access,Analysis,Analytics,Business Analysis,Business Intelligence,Data Analysis,Data Mining,Databases,Management,Matlab,Microsoft Excel,Microsoft Office,PowerPoint,Project Management,R,Research,SAS,SPSS,SQL,Statistics",Junior Data Scientist,Full Time
VALID ASIA PRIVATE LIMITED,"Engineering, Information Technology",,Professional,https://www.mycareersfuture.sg/job/assistant-engineer-%E2%80%93-data-generation-valid-asia-6c52e1c2b0aab756d92c86b4ea8771c6,"STARHUB GREEN, 67 UBI AVENUE 1 408942","Minimum Poly Diploma in IT or Engineering,1 year (Assistant)/ 3 years working experience in IT related field.,Good working knowledge on Windows 7/8/10, MS Office suite.,Candidates with programming background will have added advantage.","Responsible for all data generation process for Telco (SIM),Proper, accurate and timely documentation and update of records for data generation.,Security & Quality for data generation processes and data generation room.,Ensure Quality production at Subcontractors’ site.,Detailed outline of position:,1. Data Generation operation,Perform data generation tasks and steps for commercial order according to procedures and as per instruction.,Maintain proper records and documentation for data generation processes.,Ensure data integrity and correctness of data generated.,To check and counter check the production data and customer data are correct and 100% compliance to the written specification before distribution.,2. Order transfer to production sites,To collect all required data into a package and transfer to the production sites.,To compile the transfer documentation and cross check the data to be transferred.,To prepare PJR (Production Job Request) and ensure VALID quality processes is followed by the subcontractors,To check initial production log from the production sites, ensuring the job is setup correctly.,3. Sending Output files to the customer,To generate the output file according to customers’ specification.,Check and counter check the quality of the data.,To send the output files to the customer timely.,4. General,Ensure strictest confidentiality, integrity and safety of customer input data/files and output/response data/files.,Adhere to all security procedures defined. Ensure that all security procedures and guidelines are followed for data generation and also production.","$3,400","$2,300",Monthly,"Agile Methodologies,C,C#,C++,CSS,Eclipse,Git,HTML,Java,JavaScript,jQuery,Linux,MySQL,PHP,Python,Software Development,Software Engineering,SQL,Web Services,XML",Assistant /  Engineer – Data Generation,Permanent
NTUC ENTERPRISE CO-OPERATIVE LTD,Information Technology,,Executive,https://www.mycareersfuture.sg/job/data-engineer-ntuc-enterprise-co-operative-a118578b8fe7de0f58393562c0cdcd4e,,"Advanced degree in computer science, computer engineering, or other technical fields (or) equivalent experience.,4+ years’ experience having developed data engineering capabilities for large and complex franchises.,Strong data modeling (Kimball Preferred), system/schema design, SQL and ETL/ELT implementation skills,Thorough knowledge of any one modern columnar, distributed and MPP based RDBMS systems. Preferably AWS Redshift or Azure Cosmos DB.,Any one pipeline orchestration tool: AWS Batch, Airflow, Jenkins, Oozie, etc.,Hands-on experience in any 1 modern programming language (Java/Python preferred),Extensive experience of building platform which are “horizontally scalable”, “highly available (Three 9s or higher)” and “fully automated maintenance” on top of AWS, GCP, Azure or Ali-Cloud.,“Hands-on” experience of integrating open-source Big data technologies like Hive, Presto, Spark, Apache Ignite into traditional systems.,Good understanding basic DBMS and operating system concepts.,Frugality is in your thought and you strongly advocate using open source technologies.,You write Neat, Optimized, Well documented and Self-maintainable code.,Self-motivated and proactive, willing to learn new things, deliver best solution in most tensed situation.,Good communication skills, strong team player and mentorship s","COMPANY DESCRIPTION,NTUC Enterprise is the holding entity and single largest shareholder of the NTUC Social Enterprises. NTUC Enterprise aims to create a greater social force to do good by harnessing the capabilities of the social enterprises to meet pressing social needs in areas like health and eldercare, childcare, daily essentials, cooked food and financial services. Serving over two million customers, NTUC Enterprise wants to enable and empower all in Singapore to live better and more meaningful lives.,RESPONSIBILITIES,As a Senior Data Engineer/ Data Engineer, you will be getting,“first-hand”,break to engineer data analytics platform which will include architectural design, infrastructure setup, building data pipelines, integrate with data lakes and integrating data mining models into data pipelines.,Understand, brain-storm and integrate data from different internal as well as external platforms (including mobile event streams) to help organization to deliver top notch customer experience.,Work closely with tech heads (CXOs, Business Leaders, Engineering Managers) and their external vendors in defining and building enterprise data exchange platforms.,Design, build, support and optimize new and existing data models and ETL processes.,Develop and support the data pipeline to integrate new data from various data sources with emerging data technologies.,Define and manage SLA for all data processes and own data quality issues.","$8,000","$4,000",Monthly,"Analysis,Business Analysis,Business Strategy,Corporate Finance,Data Analysis,Equities,Financial Analysis,Financial Modeling,Investment Banking,Investments,Leadership,Management,Microsoft Excel,Microsoft Office,Process Improvement,Project Management,Research,Strategic Planning,Strategy,Valuation",Data Engineer,Full Time
NTUC ENTERPRISE CO-OPERATIVE LTD,Information Technology,,Executive,https://www.mycareersfuture.sg/job/data-engineer-ntuc-enterprise-co-operative-a1e1648c7fd2a8fcbd5ab23042e77a88,,"Advanced degree in computer science, computer engineering, or other technical fields (or) equivalent experience.,4+ years’ experience having developed data engineering capabilities for large and complex franchises.,Strong data modeling (Kimball Preferred), system/schema design, SQL and ETL/ELT implementation skills,Thorough knowledge of any one modern columnar, distributed and MPP based RDBMS systems. Preferably AWS Redshift or Azure Cosmos DB.,Any one pipeline orchestration tool: AWS Batch, Airflow, Jenkins, Oozie, etc.,Hands-on experience in any 1 modern programming language (Java/Python preferred),Extensive experience of building platform which are “horizontally scalable”, “highly available (Three 9s or higher)” and “fully automated maintenance” on top of AWS, GCP, Azure or Ali-Cloud.,“Hands-on” experience of integrating open-source Big data technologies like Hive, Presto, Spark, Apache Ignite into traditional systems.,Good understanding basic DBMS and operating system concepts.,Frugality is in your thought and you strongly advocate using open source technologies.,You write Neat, Optimized, Well documented and Self-maintainable code.,Self-motivated and proactive, willing to learn new things, deliver best solution in most tensed situation.,Good communication skills, strong team player and mentorship","COMPANY DESCRIPTION,NTUC Enterprise is the holding entity and single largest shareholder of the NTUC Social Enterprises. NTUC Enterprise aims to create a greater social force to do good by harnessing the capabilities of the social enterprises to meet pressing social needs in areas like health and eldercare, childcare, daily essentials, cooked food and financial services. Serving over two million customers, NTUC Enterprise wants to enable and empower all in Singapore to live better and more meaningful lives.,RESPONSIBILITIES,As a Senior Data Engineer/ Data Engineer, you will be getting,“first-hand”,break to engineer data analytics platform which will include architectural design, infrastructure setup, building data pipelines, integrate with data lakes and integrating data mining models into data pipelines.,Understand, brain-storm and integrate data from different internal as well as external platforms (including mobile event streams) to help organization to deliver top notch customer experience.,Work closely with tech heads (CXOs, Business Leaders, Engineering Managers) and their external vendors in defining and building enterprise data exchange platforms.,Design, build, support and optimize new and existing data models and ETL processes.,Develop and support the data pipeline to integrate new data from various data sources with emerging data technologies.,Define and manage SLA for all data processes and own data quality issues.","$8,000","$4,000",Monthly,"Analysis,Business Analysis,Business Strategy,Corporate Finance,Data Analysis,Equities,Financial Analysis,Financial Modeling,Investment Banking,Investments,Leadership,Management,Microsoft Excel,Microsoft Office,Process Improvement,Project Management,Research,Strategic Planning,Strategy,Valuation",Data Engineer,Full Time
