company_name,job_categories,job_experience,job_level,job_link,job_location,job_requirement,job_role_resp,job_salaries_max,job_salaries_min,job_salaries_type,job_skills,job_title,job_typeDEZIRE TECHNOLOGIES PTE. LTD.,Information Technology,,Junior Executive,https://www.mycareersfuture.sg/job/project-executive-dezire-technologies-5743c9ffa10568fb93ee6b8e854f7e9f,,"Candidate should possess a Degree / Diploma in Computer Science, Engineering.,1.    Good planning and co-ordination skills.,2.    Strong writing, verbal communication and presentation skills.,3.    Good team player, responsible and conscientious.,4.    Resourceful, independent, responsive and pro-active.,5.    Experience with office productivity suites such as Microsoft Office and Microsoft Project.,6.    At least 3 year of working experience in Information Technology (IT) projects.,7.    At least 1 year of working experience in data migration projects.","1.      Work with the business users, Data Migration (DM) and Functional team to achieve milestone delivery for Project data migration schedule.,2.      Participate in data mapping sessions on data extraction criteria, mapping, validation and transformation/conversion rules.,3.      Review the data mapping rules and complete the required work within agreed timeline.,4.      Maintain and keep track of the data migration requests put forward by the business users. Ensure proper endorsement obtained by the user authority and all requests are attended to, completed within the timeline and instil proper closure accordingly.,5.      Liaise with the data owners/users for the source systems data related issues.,6.      Develop functional and technical specification for source systems extracts and data loading programs.,7.      Verify and confirm the availability of data to meet Project data migration requirements, work with business users and Project team to recommend suitable default value or formula to derive those data not found in the source systems.,8.      Develop data migration programs and tools based on data mapping specifications and ensure that the development and use of the data migration programs comply with the standards, guidelines, validation and transformation rules governing the source/target systems and data.","$5,000","$4,000",Monthly,"Business Analysis,Business Development,Business Process Improvement,Business Strategy,Construction,Construction Management,Contract Management,CRM,Digital Marketing,Integration,IT Service Management,IT Strategy,Leadership,Management,Marketing,Marketing Communications,Program Management,Project Management,Project Planning,Strategy",Project Executive (Data Migration),Full Time
Singapore Tourism Board,Information Technology,,Professional,https://www.mycareersfuture.sg/job/consultant-senior-consultant-singapore-tourism-board-2c852c5beb2bc020b6dd0750ded072b1,"TOURISM COURT, 1 ORCHARD SPRING LANE 247729","At least 5 years of working experience, preferably in a similar role,Strong analytical and quantitative skills.  Knowledge of data quality concepts.,Good communication skills,Stakeholder management & Relationship building,Business process management/re-engineering,Possess understanding of data related government regulatory requirements,Experience in communicating complex issues and data concepts","Purpose of job :,Develop, communicate and implement data standards and processes to ensure quality and integrity of data assets.,Ensure compliance to government data policies and regulations, as well as advise on data to be collected to serve business needs.,Drive data quality culture by working with business units to define and monitor data quality metrics, analyze metrics results and conduct root cause analysis.,Main Responsibilities:,Responsible for overall management and strategy planning for data quality,Set data standards across STB to ensure quality and integrity of data,Develop, communicate and implement processes to be followed for data quality and metadata management,Manage data integration to create a robust tourism data hub,Identify common dimension tables across multiple datasets to enable data consistency and integration.  Ensure tables are up to date and meet business needs,Ensure data quality metrics and performances are formally reported, internally and externally as required,Work with and provide feedback to relevant business units to enhance quality of information collected,Create effective awareness campaign to promote data quality excellence,Implement audits for data quality","$6,000","$4,000",Monthly,"Analysis,Business Analysis,Business Development,Business Strategy,Change Management,Entrepreneurship,Integration,Leadership,Management,Management Consulting,Marketing,Marketing Strategy,Program Management,Project Management,Research,Social Media,Start-ups,Strategic Planning,Strategy,Training",Consultant  /  Senior Consultant (Data Quality),Permanent
SAP ASIA PTE. LTD.,Consulting ,,Professional,https://www.mycareersfuture.sg/job/presales-specialist-data-science-sap-asia-e29935b68cb10990b9920fead69107e7,"MAPLETREE BUSINESS CITY, 30 PASIR PANJANG ROAD 117440","WORK EXPERIENCE,>4 years of hands-on Full stack Applications / Solutions architecture, design and development","PURPOSE AND OBJECTIVES,We are looking for highly motivated and customer-focused individual to build Advanced Analytics and Data Science capabilities within Presales.,In the context of Digital Transformation, customers are looking at unlocking value from extensive amounts of data generated by business applications, things & social interactions. SAP has the unique ability to partner with customers in this journey with the capabilities of the Data Management Platform powered by SAP HANA. The role of Advanced Analytics Expert and Data Scientist to co-innovate with customers in Asia Pacific & Japan in generating insights through their data using SAP Data Management Platform, architecting target solutions and creating a roadmap.,EXPECTATIONS AND TASKS,This is a customer facing role & you will support the Market Units in APJ in driving the sales process by architecting big data solutions, creating insights  based on massive amounts of customer data using Advanced Analytics tools like SAP HANA, SAP Cloud Platform & SAP Leonardo Big Data & Machine Learning and create a long term roadmap for the customer,Understand the requirements by working with customers or Presales Specialists in the Market Units,Work collaboratively to architect and implement data-science solutions, mapping the data processing flow from raw data or data stores, to identifying optimal data analytics approaches, to data visualization and working with users to optimize the user experience,Support and coach developers who are involved in the project,Presentation of solutions, architecture and roadmap to customers and help the account team to progress the deal,Thought leadership on technology and ideation and creation of futuristic applications & reference architectures,EDUCATION AND QUALIFICATIONS / SKILLS AND COMPETENCIES,Bachelor or Masters degree in Computer Science,Hands on experience in developing innovative applications using modern technology platforms and cloud infrastructures such as AWS, Azure, or SAP Cloud Platform,Programming expertise in Java, Java Script, Python, R, HTML5 & web development frameworks like Spring & Play,Data modeling in both SQL & NoSQL Databases,Programming experience in HANA XS using the various capabilities like graph engine, text search, predictive etc,Experience in Hadoop tool sets (HIVE, Spark, Kafka, MapReduce etc),Exposure to machine learning (Tensorflow, Scikit–learn, MLlib etc),Degree in Statistics, applied mathematics or operations research background is preferable,Very high proficiency in customer communications, presentations and demonstration is required.,Ability and willingness to undertake customer related travel on short notice.,Fluency in English is a MUST, any other language an asset.","$8,000","$6,000",Monthly,"Business Analysis,Business Development,Business Intelligence,Cisco Technologies,Cloud Computing,CRM,Data Center,Enterprise Software,Managed Services,Management,Pre-sales,SaaS,Security,Solution Architecture,Solution Selling,Storage,Storage Area Networks,Unified Communications,Virtualization,VMware",Presales Specialist - Data Science,Full Time
NTUC ENTERPRISE NEXUS CO-OPERATIVE LIMITED,"Information Technology, Others",,"Professional, Executive, Senior Executive",https://www.mycareersfuture.sg/job/data-scientist-ntuc-enterprise-nexus-co-operative-892da7cd8e95ca26dd6d96a07bea58c9,,"Requirements:,·       Master in Statistics, Computer Science, Operations Research.,·       Familiarity with consumer marketing and ideally have industry experience (e.g. Retail, consumer banking, ecommerce, insurance etc),·       Deep understanding of statistical analysis, data mining and machine learning,·       Experience in working with large structured and unstructured data sets,·       Team player to build strong business partnerships,·       Have competency in one or more of the following programming languages or tools:  Python, R, Spark, Hive, Impala Pig or Scala,·       Ability to write production code will be an advantage","The rapid adoption of technology and mobile devices have contributed to vast new flows of information which are larger in volume, faster in velocity, diverse in variety, and requires veracity of the information for use. This new type of information composed of structured and unstructured data, broadly known as big data (and combined with tools and platforms), if utilized well, could radically improve business performance.,As the organization embarks to become a data-driven organization, significant decisions and value generation will be based on the data that we capture and deploy. The 7 SE’s range in a broad scope of data from FairPrice (retail), Income (insurance), Unity (healthcare), FoodFare (F&B), LearningHub (training), First Campus(ECE), Link (membership). The leaders of these groups are keen to utilize the data to drive growth, deliver customer service, and create personalized experiences. In this role you will work with various industries and most diverse datasets in Singapore.,We are seeking a strong candidate with advanced analytics experience to fill a data scientist position within NTUC Advanced Analytics Centre.  The role will be responsible for executing analysis and data science modelling that delivers valuable insights, providing predictive analytics solution with high quality and make sure the deployment with sound business sense. You will be proficient in the application of customer transaction data, click-streaming data and unstructured data & analytics techniques to domain specific problems such as customer segmentation and targeting, cross- sell/up-sell propensity model, acquisition model, retention model and marketing campaign testing, recommendation and personalization etc.,Responsibilities:,·       Work with various teams to plan, identify, collect and integrate data from multiple systems,·       Building and automate of the data workflows such as extraction, transformation and load (ETL) to transform raw data for analytic purpose,·       Define analytical strategy to address identified opportunities, including analytical approaches, data and technology requirements.,·       Develop models and perform statistical analysis to solve various strategic business problems,  e.g. customer segmentation and targeting, propensity model, acquisition model, retention model and perform marketing campaign testing.,·       Communicate and present key analytical findings to senior management and/or other stakeholders with actionable recommendations.,·       Deploy analytical/optimization solutions to drive growth,·       Work with other data scientists in the team to drive projects","$7,000","$4,000",Monthly,"Analysis,Business Analysis,Clinical Data Management,Clinical Trials,Data Analysis,Data Management,Databases,Earth Science,EDC,GCP,Information Management,Leadership,Management,Microsoft Office,Microsoft SQL Server,Oracle Clinical,Program Management,Project Management,Research,SQL",Data Scientist,Full Time
FRIARTUCK PTE LTD,"Consulting , Information Technology",,"Professional, Executive, Senior Executive",https://www.mycareersfuture.sg/job/data-engineer-friartuck-e8e662f966d095b2b32e8e377867d458,"THE ALPHA, 10 SCIENCE PARK ROAD 117684","Responsibilities,Build the infrastructure and set up routines for optimal ETL for data from wide varieties of data sources utilizing SQL,Design and build normalized and denormalized database solutions using healthcare industry best practices for data warehousing for specific client requirements, using Microsoft SQL Server Database programming (stored procedures and database design),Work with internal stakeholders to understand business needs for data structure, availability, scalability and accessibility; support translation of these data business needs into technical system requirements and build greater functionality to our data systems,Identify opportunities for improvements and provide ongoing optimization, monitoring and tracking of data flow/ pipeline architecture,Provide data management support to users,Develop technical and training manuals,Requirements,BSc degree in Computer Science or relevant field,5-7 years of experience as a database developer or database engineer,In-depth understanding of data management (e.g. permissions, recovery, security and monitoring) and Relational Database Management Systems,Knowledge of software development and user interface web applications,Hands on experience with SQL,An ability to understand front-end users' requirements and a problem-solving attitude,Benefits,Opportunity to work with senior stakeholders and lead high-value projects with large enterprise clients,Opportunity to work on our cutting edge AI and optimization software,Competitive salary package","We are looking for a savvy,Data Engineer,to join our growing team of analytics experts. The hire will be responsible for expanding and optimizing our data and data pipeline architecture, as well as optimizing data flow and collection for cross-functional teams. The ideal candidate is an experienced data pipeline builder and data wrangler who enjoys optimizing data systems and building them from the ground up. The Data Engineer will support our software developers, data analysts and data scientists on data initiatives and will ensure optimal data delivery architecture is consistent throughout ongoing projects. He/She must be self-directed and comfortable supporting the data needs of multiple teams, systems and products. The right candidate will be excited by the prospect of optimizing or even re-designing our company’s data architecture to support our next generation of products and data initiatives.","$8,000","$6,000",Monthly,"Access,Business Analysis,Business Intelligence,Data Analysis,Database Design,Databases,HTML,Integration,Management,Microsoft Excel,Microsoft SQL Server,Process Improvement,Program Management,Project Management,SDLC,SharePoint,SQL,T-SQL,Visio,Windows",Data Engineer,"Permanent, Full Time"
MEGAMIND CONSULTING PTE. LTD.,Information Technology,,Professional,https://www.mycareersfuture.sg/job/data-integration-architect-megamind-consulting-a333006714333386a028e7d79aba859b,"SAMSUNG HUB, 3 CHURCH STREET 049483","kills,You are familiar with...,Data Integration & Federation:,·       e.g. SAP, IBM, Oracle, Microsoft, Informatica, Ab Initio, and data integration tools for Hadoop-based architectures.,Data Repositories:,·       e.g. Oracle, Teradata, SQL Server, Netezza, DB2, Greenplum, Amazon Redshift, Cassandra, Hadoop.,EA License No. 14C7181 Reg No. R1222538","As a Data Architect, you will work with our business teams to enable the design and build of repeatable analytics solutions, and to help drive innovation through proof of concepts and underlying capabilities.,Accountabilities,We seek an individual who will embody a collaborative approach in bringing both business and technology stakeholders together to deliver technology solutions that enable tangible business benefits.,What you will do...,·       Own the definition of data architecture components for information management solutions to facilitate storage, integration, usage, access, and delivery of data assets across the enterprise.,·       Produce and approve architecture diagrams for enterprise data and analytics solutions including conceptual, logical and physical.,·       Architecting conceptual, logical and physical data models using data modelling approaches (e.g. 3NF relational, Kimball dimensional) in standard modelling tools.,·       Designing the data integration architecture based on solution requirements e.g. real-time, near real-time, batch.,·       Support, Define and manage work packages that deliver elements of an information management solution e.g. data warehouse, data mart, ETL service, operational data store.,·       Solve the challenge of integrating disparate sources of enterprise data and information to model and visualize their businesses and derive insight.,·       Develop and maintain long lasting relationships with senior stakeholders, both during and outside of project delivery.,·       Supporting a data design work-stream in an agile delivery or on a large-scale ‘waterfall’ delivery project for an enterprise data warehouse or reporting solution.,·       Lead the design of the architecture for an on-premises or cloud-based, data warehouse, or big data solution; this could cover several technologies, countries and lines of business.,·       Lead and Assist in the further development of our capability through proof-of-concepts.","$9,000","$6,500",Monthly,"Business Analysis,Business Intelligence,Data Analysis,Data Architecture,Data Integration,Data Modeling,Data Warehouse Architecture,Data Warehousing,Database Design,Databases,Enterprise Architecture,ETL,Integration,Master Data Management,Microsoft SQL Server,Oracle,PL/SQL,Requirements Analysis,SDLC,SQL",Data Integration Architect,Full Time
GIC PRIVATE LIMITED,Banking and Finance,,Middle Management,https://www.mycareersfuture.sg/job/associate-data-engineer-gic-55a22c4264e591bcaee716bce709fb60,"CAPITAL TOWER, 168 ROBINSON ROAD 068912","Requirements,Good degree in Computer Engineering, Computer Science or Information Systems.,Highly proficient in Python.,Around 1-3 years’ of relevant experience in data warehousing, SQL stored procedures, ETL, data pipeline building and data analysis.,Strong analytical and organization skills, with the ability to collect, organise, analyse, and disseminate significant amounts of information with attention to detail and accuracy.,Good team player.,Motivated and driven, able to work independently on technical projects.,Experience in processing data in SQL databases and big data platforms such as Hadoop.,Familiarity with open sourced platforms and libraries such as Spark, Alteryx, D3.js, Hadoop, Solr, Elasticsearch,Knowledge of dashboard creation and visualisation using Tableau and D3.js will be an added advantage.,Please submit your job application to the following link :,https://career10.successfactors.com/sfcareer/jobreqcareer?jobId=5893&company=gicprivate&username=","Internal Audit Department (IAD),Internal Audit Department (IAD) has been tasked with the mandate to foster a strong governance and control environment in GIC.  IAD provides an independent assessment of GIC’s governance, risk management and internal control environment to key stakeholders including the Board of Directors and senior management. IAD acts as a trusted business partner working closely with the GIC group of companies and investment holding entities to bring about positive changes to the control environment and culture and thereby support senior management decision making.,We are looking for a suitable candidate to join the,Internal Audit Data Analytics,team.,IAD has leveraged data science to achieve greater risk coverage, stronger assurance and deeper business insight. Our data science capabilities include machine learning for anomaly detection and risk identification, the use of Natural Language Processing (NLP) to analyze unstructured data, and proficiency in “Big Data” platforms for efficient analysis of vast datasets. These capabilities have allowed IAD to progress towards a systematic, continuous audit approach with multi-dimensional analysis of complete data sets. With the strategy of integrating data science as a key IAD competency, existing talent are also equipped with new skillsets around the use of data analytics, programming languages and visualization tools.,Responsibilities,Analyse heterogeneous and unstructured data, and generate actionable insights to enhance risk and control activities.,Work on Big Data infrastructure such as Hadoop to efficiently search data on very large datasets.,Work closely with business stakeholders to analyse large data sets, trends and results to drive data-driven operational risk decisions.,Collaborate with an existing internal community of data scientists to solve complex problems and influence change.,Keep abreast of market developments in data analytics and recommend adoption of best practices into GIC.","$9,000","$4,500",Monthly,"Business Development,Business Strategy,Customer Service,Due Diligence,Financial Analysis,Financial Modeling,Leadership,Management,Marketing,Mergers & Acquisitions,Microsoft Excel,Microsoft Office,Private Equity,Project Management,Public Speaking,Research,Social Media,Strategic Planning,Strategy,Valuation","Associate, Data Engineer",Full Time
